Job Title,Company,Location,Job Link,Salary,Job Type,Posted Date,Vacancy,Description
Lead AI Engineer,AI4LYF,Lahore,https://pk.indeed.com/company/Ai4lyf/jobs/Lead-Ai-Engineer-66ac417c7a9b81c2?fccid=2bac158e9414aed6&vjs=3,,Full-time,Posted 30+ days ago,Application response rate: 85%,"Job Description/ Main responsibilities:

Facilitate in translating Health-related problems into marketable solutions using machine learning, deep learning, data science, mathematical and statistical tools, and domain (healthcare) knowledge
Develop data understanding and share insights with Exploratory Data Analysis (EDA) and Confirmatory Data Analysis (CDA)
Develop state-of-the-art machine learning and deep learning models for prediction and classification using heterogeneous multi-modal data
Develop a complete data pipeline for the machine learning tasks
Set up and maintain environments for developing and testing advanced analytics and machine learning projects.
Integrate solutions with the backend and front end
Provide close technical supervision and assistance to teammates in machine learning-related programming tasks to ensure that the best coding practices are followed.
Provide conceptual clarity and guidance to teammates in choosing appropriate machine-learning models and tools
Develop and implement the schemes for the timely installation and upgrading of appropriate required packages and libraries for machine learning models
Document the complete model development process for regulatory compliance, and prepare user guides and reports for the stakeholders
Develop model development methodology and schemes to follow with time bound milestones and prepare group and individual KPIs for the team members
Prepare individual team members tasks using project management tools and ensure the tasks are completed timely
Develop and conduct technical training programs for the team members for continuously improving their programming skills and practical knowledge of ML

Tasks you will be performing on daily basis as ML/AI Engineer:

Ensure that the work of team members is aligned with the action plan, milestones are achieved and KPIs are met
Provide close technical supervision and assistance to team members
Lead AI engineers closely in the development of ETL for machine learning tasks
Lead AI engineers closely in the data pre-processing for complex heterogeneous (signal, tabular, text, image etc.) data
Validate data pipelines, codes, models, and implementations to ensure the quality, accuracy, and consistency of the solutions in the real environment
Address logic building and coding challenges faced by the team mates
Review the codes, model architectures, implementation schemes and debug them, address the issues and optimize them and educate AI engineers to improve in those areas
Develop ML/DL/ mathematical/ and statistical models for addressing problems and exploiting opportunities related to healthcare
Prepare documents and reports for compliance and management purposes

Experience, knowledge and skills required:

Experience in leading end-to-end ML projects
Experience in closely supervising teams working on AI tasks
Experience in developing, documenting and managing programming/software development projects
Experience in development of multiple machine learning and deep learning projects
Proficiency in python coding, data management, machine learning, deep learning and data visualization libraries and packages
Comprehensive knowledge of best coding practices, deep understanding of ML/DL/Stats/Math concepts

Preference will be given to candidates who have:

Experience of developing AI marketable products
Demonstrable clarity of architectures, implementation, and optimization of machine learning and deep learning models
Experience in programming in Python and knowledge of good coding practices
Experience with one of the cloud services: Google Cloud, AWS, Azure
Knowledge of using ssh, bash, and linux
Understanding of python web framework FLASK/ Django
Understanding of front-end technologies HTML/JavaScript/CSS and related web technologies
Experience in leading machine learning projects
Experience of building and grooming teams of creative people

Qualification:

Master in Artificial Intelligence/Data Science/ Software engineering/ Computer Science/ ECE or equivalent from a renowned university.
Master and 4+ years’ experience in machine learning and deep learning projects management
PhD in Artificial Intelligence/ Data Science/ Software engineering/ Computer Science/ ECE or equivalent from a renowned university.
PhD with thesis pending candidates can also apply

Job Type: Full-time, in-office, day shift.
Salary: A highly competitive/lucrative salary package based on skill set, qualification, and work experience. The package will also include generous bonuses-based rewards for outstanding performance throughout the employment and opportunity to get shares.
Please share your GitHub/ Kaggle profile if available.
Job Type: Full-time
Salary: Rs100,000.00 - Rs180,000.00 per month
Ability to commute/relocate:

Lahore: Reliably commute or planning to relocate before starting work (Required)
"
Data Engineer,Solution Services & Consultancy,Lahore,https://pk.indeed.com/company/Solution-Services-&-Consultancy/jobs/Data-Engineer-405bbe9ed1e8bf72?fccid=9b56dcb48cb6e62f&vjs=3,,Full-time,Posted 30+ days ago,Hiring 10+ candidates for this role,"Who is Solution Services Consultancy?
Solution Services Consultancy is a specialized IT service-providing company. We specialize in helping our clients in building the “Tech of the Future” such as:
Big data tech: data engineering, micro-services & analytics
Distributed tech: blockchain & NFTs
Cognitive tech: Artificial Intelligence & Machine Learning
Spatial tech: Augmented & Virtual Reality, metaverses, gaming & gamification
Physical tech: IOT and Edge computing
And much more...
We at Solution Services and Consultancy provide the highest standards of consultancy services, delivering value and excellence. It is with this vigor that we work meticulously to understand the requirements of our clients and establish perfect harmony between solution implementation and business consultancy. Our firm lives by the canon of cultivating long-term relationships, based on trust and integrity, with its most treasured assets - clients & employees. At SSC, ethics and best business practices are not just enforced, but celebrated! All of this, with the objective of becoming the most reliable and trusted business and solution consultancy firm, globally.
Job Description
We are looking for world-class talent to join acrack team of engineers, product managers and designers. We want people who are passionate about creating software that makes a difference to the world. We like people who are brimming with ideas and who take initiative rather than wait to be told what to do. We prize team-first mentality, personal responsibility and tenacity to solve hard problems and meet deadlines. As part of a small and lean team, you will have a very direct impact on the success of the company.As a data engineer you will:
•Design, develop and maintain aninfrastructure for streaming, processingand storage of data. Build tools for effective maintenance and monitoring of the data infrastructure.
•Contribute to key data pipeline architecture decisions and lead the implementation of major initiatives.
•Work closely with stakeholders to develop scalable and performant solutions for their data requirements, including extraction, transformation and loading of data from a range of data sources.
•Develop the team’s data capabilities -share knowledge, enforce best practices and encourage data-driven decisions.
•Develop data retention policies, backup strategies and ensure that the firm’s data is stored redundantly and securely.
Job Requirements
● Solid Computer Science fundamentals, excellent problem-solving skills and a strong understanding of distributed computing principles.
●At least 3 years of experience in a similar role, with a proven track record of building scalable and performant data infrastructure.
●Expert SQL knowledge and deep experience working with relational and NoSQL databases.
●Advanced knowledge of Apache Kafka and demonstrated proficiency in Hadoop v2, HDFS, and MapReduce.
●Experience with stream-processing systems (e.g. Storm, Spark Streaming), big data querying tools (e.g. Pig, Hive, Spark) and data serialization frameworks (e.g. Protobuf, Thrift, Avro).
●Bachelor’s or Master’s degree in Computer Science or related field from a top university.
●Able to work within the GMT+8 time zone
What will the process look like?
●Application: you will submit an online application form, which will take you less than 10 mins to complete
●Test: you will take a 45min online test
●Interview: there will be 1-2 rounds of interviews.
Job Type: Full-time
Salary: Rs150,000.00 - Rs250,000.00 per month
Application Question(s):

Apply to this link 

https://forms.gle/QfJ118qZpMr4TPQJ9"
Motion Graphics Designer,Info Resume Edge,Lahore,https://pk.indeed.com/company/Info-Resume-Edge/jobs/Motion-Graphic-Designer-d6a6ef24ae6bc19e?fccid=7aa81f237b9366e4&vjs=3,,Full-time,Posted 9 days ago,Hiring 1 candidate for this role,"Company Profile:
Programmers Force is a product-driven software company that excels in the field of Artificial Intelligence and Machine Learning since 2016. The company was founded by a team of visionary entrepreneurs that led its operations under software development, data science, DevOps, system architecture, big data processing, and blockchain-based applications development. We take pride in our diversified workforce with talent coming from top institutions of Pakistan and abroad. Our vision is to create innovative and intelligent business solutions through the development of smart web & mobile applications with a mission to support global industries in their day-to-day business challenges. Our specialised teams possess tacit knowledge of high-tech systems that enables us to tap businesses from more than 200 countries worldwide. This is just the beginning for us! We are in search of talented candidates with technical expertise who can add value to our fast-paced and work-intensive environment.
Tack of Programmers Force:
Not only the way out but the best way out! No rather, no “one or two” but a must for all. Win-Win is the goal.
Job Description:
We are looking for a “Motion Graphics Designer” to plan, design and develop web applications and web pages visual design tools. You will be responsible for delivering the best online user experience, which makes your role extremely important for our success and ensuring customer satisfaction and loyalty.
Roles & Responsibilities:

Draft and animate numerous 2D/3D motion graphics and creating GIFs from scratch as well as animating existing assets.
Maintain up-to-date knowledge about latest motion graphics design techniques and styles.
Develop, maintain, and consistently innovate the design, templates, best practices, and visualcontent of our brand on social platforms.
Work with the team to devise customer solutions that meet the needs of the markets weserve.
Prepare design plan, concept and layout for motion graphics projects.
Possess strong knowledge of Adobe After Effects and Adobe Premiere Pro or similar tools.


Education & Experience Requirements:
BS/MS degree in CS or B-Design, or commensurate experience or similar degree.
Proven Work Experience
Portfolio of Design Projects.
Background in Animate and 2D/3D motion graphics.
Familiarity with interaction design and information architecture.
Effectiveness with Design and UX Softwares like Adobe Creative Suit, Adobe Illustrator,Adobe Photoshop, InDesign, Acrobat, Dreamweaver, UXPin, zalsamiq and InVision.
Knowledge of HTML, CSS, Javascript.
Detail Oriented, Strong Analytical Skills with Business Acumen and ability to think out of theBox.
Good Communication and Presentation skills.
Problem Solving Aptitude, Customer-Centred and ability to work as a Team Player.
Ability to work in a work-intensive environment and meet short-notice zeadlines.
Ability to align Business Marketing Goal with the Design ArtWork.

Job Type: Full-time
Application Question(s):

Must Be Problem Solving Aptitude, Customer-Centred and ability to work as a Team Player
Must have Effectiveness with Design and UX Softwares like Adobe Creative Suit, Adobe Illustrator,Adobe Photoshop, InDesign, Acrobat, Dreamweaver, UXPin, zalsamiq and InVision.

Knowledge of HTML, CSS, Javascript.
Education:

Bachelor's (Preferred)

Experience:

Animate and 2D/3D motion graphics.: 1 year (Required)
Adobe Creative Suit: 1 year (Required)
Adobe Illustrator: 1 year (Required)
Acrobat, Dreamweaver, UXPin, zalsamiq and InVision: 1 year (Preferred)
"
Capital Planning Intern,Afiniti,Lahore,https://pk.indeed.com/rc/clk?jk=d60e91d1a584718d&fccid=b699f89e027ca757&vjs=3,,Internship,Posted 30+ days ago,,"

Who are we?


  Afiniti is the world’s leading applied artificial intelligence and advanced analytics provider. Afiniti Enterprise Behavioral Pairing™ uses artificial intelligence to identify subtle and valuable patterns of human interaction in order to pair individuals on the basis of behavior, leading to more successful interactions and measurable increases in enterprise profitability. Afiniti operates throughout the world, and has measurably driven billions of dollars in incremental value for our clients.
 


Purpose


  We are looking for someone who is a critical thinker and hardworking. People who has exposure to technology industry and business expertise will be preferred. The candidate must have excellent communication and writing skills.
 


Key Responsibilities


Reporting
Planning and monitoring of daily tasks
Managing Ticketing System
Keeping track and maintaining reports for upcoming projects
Creating and/or reviewing manuals, procedures, and related user documentation



The ideal candidate will have


Excellent communication skills (written and verbal)
Possess Reporting and Analytical Skills
Outstanding organizational and coordination abilities
Ability to multi-task, working on more than one issue simultaneously.
Must be able to work in EST hours (4pm – 1am).




Education & Qualifications


Bachelor’s Degree

"
Full Stack Engineer,Solution Services & Consultancy,Lahore,https://pk.indeed.com/company/Solution-Services-&-Consultancy/jobs/Full-Stack-Engineer-d6e7a356fa17ad32?fccid=9b56dcb48cb6e62f&vjs=3,,Full-time,Posted 30+ days ago,Hiring 10+ candidates for this role,"Who is Solution Services Consultancy?
Solution Services Consultancy is a specialized IT service-providing company. We specialize in helping our clients in building the “Tech of the Future” such as:
•Big data tech: data engineering, micro-services & analytics
•Distributed tech: blockchain & NFTs
•Cognitive tech: Artificial Intelligence & Machine Learning
•Spatial tech: Augmented & Virtual Reality, metaverses, gaming & gamification
•Physical tech: IOT and Edge computing
•And much more...
We at Solution Services and Consultancy provide the highest standards of consultancy services, delivering value and excellence. It is with this vigor that we work meticulously to understand the requirements of our clients and establish perfect harmony between solution implementation and business consultancy. Our firm lives by the canon of cultivating long-term relationships, based on trust and integrity, with its most treasured assets - clients & employees. At SSC, ethics and best business practices are not just enforced, but celebrated! All of this, with the objective of becoming the most reliable and trusted business and solution consultancy firm, globally.
Job Description
We are looking for world-class talent to join a crack team of engineers, product managers, and designers. We want people who are passionate about creating software that makes a difference in the world. We like people who are brimming with ideas and who take initiative rather than wait to be told what to do. We prize a team-first mentality, personal responsibility, and tenacity to solve hard problems and meet deadlines. As part of a small and lean team, you will have a very direct impact on the success of the company. As a Full Stack engineer, this is what you’ll do:
•Design, develop, and maintain JavaScript-based, React, and Node.js applications.
•Implement, update, and maintain back-end and front-end components. We try to cater to the team’s strengths and preferences as much as we can when deciding who does what.
•Follow best coding practices, and create code that you are proud of, with extensibility, scalability, and performance in mind.
•Help design the architecture and own development of major initiatives and modules.
•Help level up the team; share knowledge, conduct code and design review; drive code quality and process improvement initiatives.
•Work in cross-functional teams with product managers, UX designers, and QA engineers to ship software on-quality and on time.
Job Requirements
● Solid Computer Science fundamentals, and excellent problem-solving skills.
●Expert-level understanding and familiarity with JavaScript, React, And Node.js, with a proven track record of shipping successful software products.
●Good communication skills (written and verbal), proven team player, rolling up the sleeves and getting involved in the nitty gritty.
●Familiar with Agile Methodology.
●Bachelor’s or Master’s degree in Computer Science or a related field from a top university.
●Able to work within the GMT+8 time zone
What do we offer?
●An exciting and passionate working environment within a young and fast-growing company.
●The opportunity to work with a high-performing team
●A competitive salary package.
●The ability to work from anywhere in the world (assuming a stable internet connection)
●The chance of being a fundamental part of the team and making a difference.
What will the process look like?
●Application: you will submit an online application form, which will take you less than 10 mins to complete
●Test: you will take a 45min online test
●Interview: there will be 1-2 rounds of interviews.
Job Type: Full-time
Salary: Rs150,000.00 - Rs200,000.00 per month
Application Question(s):

Apply to this link 

https://docs.google.com/forms/d/e/1FAIpQLSdsUITn91KiwLSQ_n9w5foiXFJFZfOzgR5UYBDm2rnObyIqGA/viewform"
Unity 3D Developer,DevCrew.io,Lahore,https://pk.indeed.com/company/DevCrew.IO/jobs/Unity-Developer-6bfba53636997b2e?fccid=a80ef8395fdfedc5&vjs=3,,Full-time,Posted 30+ days ago,Hiring 1 candidate for this role,"We are looking for a Unity 3D developer for a long-term collaboration, working ON-SITE with our Devcrew I/O team.
Responsibilities

As a Unity3D developer, you will be responsible for building gameplay systems and features on multiple platforms.
You will work closely with our team of programmers, designers, and producers to drive decisions for the projects you will be involved in.
Can Develop both 2D & 3D Games based on the unity framework.
Must have extensive experience of in-app purchases and Ads integration.
Good experience in Programming and the Unity Engine.
The selected candidate will be involved at various levels (UI/UX, Optimizations, file handling, data structures, design patterns, animation, project architecture) during the game production.
Can transform design ideas into functional games. Excellent debugging, problem-solving skills, optimization skills, and knowledge of basic algorithms & Data Structure.
Should have excellent organizational skills, and ability to work well under deadlines, and the ability to write clear, well-documented, reusable code.
Follows new technology trends and loves learning new things.
Construct the base of the engine on which the game will run
Produce prototypes of gameplay ideas and features
Develop schedules and determine milestones
Generate game scripts and storyboards Animate characters and objects
Contribute to the design and audio features of the game
Create unit tests and validation procedures to assure quality
Detect identification and resolution and document technical specifications
“Polish” the game, maintain code, fix bugs, and iron out occurring problems

Requirements:

Prior experience in creating AR Lenses for Snap’s Lens Studio will be considered a HUGE PLUS!
Minimum 2 years of Proven working experience in full-lifecycle game development
Hands-on experience primarily with C++ or other programming languages (Java, C, etc.)
High-level knowledge of APIs and libraries
Expert in one or more programming specialties (artificial intelligence, 3D Rendering, 3D animation, physics, multiplayer/networking, or audio)
Up-to-date with the latest gaming trends, techniques, best practices, and technologies
Ability to solve problems creatively and effectively
BS degree in Computer Science or Games Technology

Benefits 
DevCrew I/O is committed to providing equal learning opportunities and work-life balance to all its employees. Our standard benefits package available to all staff includes:

EOBI
Paid OT
Health Insurance
Gym Allowance
Leave Encashments
Annual Trips
Daily Lunch
Monthly Lunch/Dinner

Job Type: Full-time
Salary: Rs100,000.00 - Rs150,000.00 per month
Application Question(s):

How many years of experience do you have in Unity Development?
"
